车名,用户ID,最满意,最不满意,空间,驾驶感受,续航,外观,内饰,性价比,智能化
Model Y 2024款 后轮驱动版,沈阳车友8294437,想去哪就去哪.不用因为加油贵而惆怅.充电速度快.电门非常给力.踩上就走.一点延迟都没有.指哪打哪.加速又快.绿灯起步随便就把后车甩在后面.单踏板模式也好好用.轻抬减速同时动能回收.用习惯以后我几乎没踩过刹车.AP辅助驾驶在高速路段上真的很香.我有超过一半的路程.都是用它来自己开的.只需要把手扶在方向盘上.监督他就行.自带跟车和紧急避险功能.再也不怕追尾和车道偏离了.使用体验超级好.OTA升级：车机系统经常更新换代.每次更新都能带来更好用的操作系统和更多的娱乐功能.常开常新.可玩性贼强.,没有遮阳帘夏天太热了🥵.座椅没有通风.,空间好.座椅舒适.包裹感.乘坐空间大.储物空间大.对我来说选y不选3的主要原因就是储物空间大.不仅有前备箱.后备箱还是双层的.简直绝绝子了.外出工作我需要的用到的器材都可以装进车里.后排放到还可以变成双人床.没有然后发动机.露营睡觉也不担心安全了.,超出预期满族需求,加速非常快.方向盘重.刹车嘎嘎好.开空调也不影响提速.,沈阳用车.经常用公用充电桩.冬天冲的慢一些.夏天很快.春秋也是可以.已经是行驶了将近170公里的剩余电量了.,车身设计的非常好.各种腰条.车头造型.车尾设计,内饰用料好.空调效果好.没有异味.很舒服.内饰分化的好严重.我觉得没有实体按钮看着干净立正.不高级的样子.爱得不行.看见别的车有那么的按键🎹和旋钮会觉得好乱啊.,性价比超高.购车有优惠.保养项目少.售后服务也非常不错.我觉得这应该是所有新能源车的优点.充电便宜.保养便宜.很多停车场还有免费的时长.因为用车成本低.买车以后我就满世界的开车游玩.还能告别车钥匙.上车流程优化到了极致.不用带车钥匙.不用松手刹.直接开门上车.挂档出发.下车更潇洒.关车门.窗户.空调.音乐系统通通不用手动去操作关闭.燃油车麻烦的狠.朋友要去车上拿东西.远程操控一下就好了.直接可以远程解锁.找不到车还可以远程鸣笛🚨亮灯来帮助寻车.
Model Y 2024款 后轮驱动版,昱奕财税,空间最满意，本来打算买model3的，家里有了一台宝马三系，怕开SUV不习惯，后来去试驾了一下modely，感觉挺好开的，视野也特别大，比轿车坐姿高，提速也杠杠的，比油车直接，回家跟领导（媳妇的简称）一商家，还是买modely吧！空间比3大多了！,细节做的不够精致，遇到颠簸路面车顶有时会有异响，还有就是地盘太硬，比轿车差多了！,我身高175，开车的时候调到我合适的姿势，头上还有一拳多，可能是因为是玻璃顶的原因，感觉不到压抑，厂家能配个电动遮阳帘就更完美了，虽然说是防晒玻璃，但是摸上去还是很热的,电动手套箱非常高级，还可以设密码，相当于多了一个车载密码箱！前后备箱也很大，家用足够了。,动力随叫随到，非常轻盈，完全感觉不到这是将近二吨的大块头！方向盘也是指哪打哪，比油车感觉少了半圈，刹车是买车前最担心的，网上各种负面新闻，非常担心刹车性能，等我开了以后才发现，网络上都是以讹传讹，刹车非常不错，我没有开通单踏板模式，就当油车开，不差那点动力回收，电费又不贵。,表显续航满电435，跟网上标的550多还是有差距的，好在特斯拉系统里的续航比较准确，我基本上都是上下班开，跑长途用油车，谁让自己口袋米不够，不然肯定上长续航了！,前面看真好看，侧面看也不错，就是后面看有点丑，宽跟高不成比例，如果再宽十公分，或者车矮五公分应该会更好看！这也是我纠结很久的地方,绝对毛坯，氛围灯只有前驾驶台有一条，你家model3都是全包围氛围灯，厂家够扣的，几米彩灯也要不了多少钱吧！！,座椅包裹性不错，舒适度一般，第二排也算够用，空间肯定没有我的320Li大，这车没有通风座椅，夏天开久了估计屁股要出汗，座椅包裹性肯定没有轿车里的沙发舒服，买之前就做好心里准备了，只要三电系统没问题，其他内饰毛坯就毛坯吧，勉强接受了
Model Y 2024款 后轮驱动版,沈阳车友4560530,加速体验非常满意，空间也比之前开的传统车大上不少。而且上车下车一个手机足矣，不需要带钥匙。还有就是春天续航和表显基本能保持一致。使用费用跟传统燃油车相比确实非常低。沈阳地区晚上充电4毛5左右，充满也只需要30左右。一公里不到1毛钱，开上特斯拉就没考虑过公里数！,"1、导航！非常不好用！道路标识时有时无，经常到路口了才发现自己站错道了。
2、语音识别经常出错。
3、hw4.0车型没有雷达！停车时前后车距不清晰。不知道是不是我车个例原因还是都有这个问题，等信号灯时，如果前车是大公交车，公交车已经启动开远了，我的车机还会显示警报。
4、天冷时开空调特别热！天热时开空调又特别冷。都是调节到21度。但是确实体感不是那么舒服。",前后背箱空间足以三口之家出行旅游所需空间，家里孩子比较小，有自己的被褥和枕头之类的一个前背箱足以放下孩子所需的物品。后备箱放了一个床垫和隐私帘。自驾游时开车累了可以躺下休息。毕竟自驾游要的就是轻松一点。,之前开大众车一般驾驶员左侧有一个小空间用于放置证件和票据的，一开始以为model y没有，还挺失望，结果群友推荐神器。确实好用，隐私性还特别好。,操控可以，方向精准，油门响应灵敏，高速踩就有，转向支撑也可以。,吉林提车沈阳开，三月十日提车，天气不是特别暖和。从吉林长春回沈阳，高速320公里。新车满电表显435。高速全程120km/h中间充了一次电。可能不充也能跑到。但是第一次开电车，信心不是特别足,是我喜欢的造型，不然也不能买不是。,漆面比较薄，蹭过一个垃圾桶，model y输了,"内饰只能说够用，而且大多都不耐脏且吸灰！对在车内吸烟的人不太友好，烟灰不好打理。
手机支架不太好挑选，放正前方方向盘会有遮挡，想不遮挡买了个吸附在中控屏上的支架，调节空调又特别麻烦。"
Model Y 2024款 后轮驱动版,流逝的岁月年华,"原本一个月3k油费现在只要200电费。
爽。。。。。",这车舒适型应该是好了很多了。但是还是比较运动。不是很舒适。买回来刚开始时候有点味道，要过一段时间才没有。原车漆显脏。,一般般够用。一家人外出远门油车，一个人就摩托车。特斯拉上班一个人开的。足够了。,"电车开着就是比油车运动。起速快。
转向很贼。我之前的车都没法比，习惯了好久。","两天充一次。有时候一天充一次。我有焦虑症。
手机低于30%焦虑现在车子低于200km续航也焦虑。",贴了改色。帅。改了个白变金（亚）。贴了熏黑的标志。,毛坯房。不过简单也许是最好的。有个油车走温馨风了。再来个毛坯风也不错。,五年免息。在加上现在的价格让之前买这个车的朋友要跟我恩断义绝了。,比我之前的油车不知道好多少。蛮好的。就是很多功能后期都要付费。
Model Y 2024款 后轮驱动版,Al史蒂芬,本来一心想换BBA的，试驾之后直接定了MY，正好降价14000，5年免息，要说满意的就是外观和空间了，之前两厢车空间有限，4月26订的车，4月30号就让提车了。,车漆真的太薄了，一个小石子都能蹦个坑，看见底漆，尤其周围车辆的开门杀，一碰就是一块漆，夏天是真的热，不开过热保护的话，车里动不动就是80度😂😂😂,储存空间真的棒👍🏻想到的想不到的地方都能放东西，后排座椅中间，前排座椅下面都可以买着小盒子放东西。,没吃过啥好猪肉，起步还是能秒百分之90的车的，操控也非常棒，送了三个月eap，高速，高架用的还不错，不过这个版本目前自动泊车和召唤不可用，推送了几次，还是不管用。,目前提车一个月了，跑了3500公里，可能因为夏季吧，一直开空调和过热保护，基本上一次充满跑300公里左右，4天一充，到现在没用过家充，一直都是快充0.94一度电，充过一次超充，好像2.6一度电，😂😂😂,目前表显435，夏天的话300左右,外观没得说，今年是星空灰，其它颜色都要8000，果断后期贴车子改色了，,吐槽的最多的就是内饰了吧，正儿八经毛坯房，而且基本都是毛毡，不大好清理，对抽烟的朋友也很不友好。,前排座椅比上个版本好一点了，没那么颠了，但是后排还是很颠，但是想想哪个运动版本的车不颠啊？我哥的E300运动，无论开还是坐，同样颠😂😂（自我安慰吧）
Model Y 2024款 后轮驱动版,兔斯基的特斯拉,特斯拉的三电系统和AP辅助驾驶，城区跑基本上百公里消耗电量在12KW左右，柔和模式下动力随踩随有，像3.0自吸燃油车，标准模式下电门非常灵敏，深踩一脚推背感很强，像3.0T增压车；AP辅助驾驶跑高速很省心省力，下拉俩次自动开启彩虹之路的辅助驾驶。,底盘还是偏硬，过一些沟沟坎坎反馈很明显，尤其是过减速带特别震。,储物空间非常大，前备箱可以放20寸行李箱和电脑包，后备箱下面可以放俩箱水以及杂物，后排座椅打倒可以当双人床，前后排乘坐空间也非常充裕。,驾驶偏运动风，方向盘一圈就能打死，真的指哪打哪，车辆循迹也很好，唯一不足就是倒车没360全景影像。,标续554，实际充满电435，50%高速和50%国道可以跑到这个435，纯国道可能跑的更多一些。,外观很好看，尤其是前脸和侧45度角特别流线型，就是从后面看有点像鼠标。,特斯拉内饰都说是毛坯房，反正就是够用吧，后续自己加装一些实用的东西。,"标续y裸车24.99，我是旧车置换，官方有5年免息，如果新购车就是3年免息，本地有个以旧换新车补5k,新车是3k，没有任何礼品。",车机流畅度很好，AP和EAP辅助驾驶很好用，就是自带的百度地图没高德地图好用，希望早日落地FSD
Model Y 2024款 后轮驱动版,青莲剑仙1,第一次开特斯拉，操控非常好，提速也很快，刚开始开的时候有点头晕，可能不太适应，因为之前开的是油车，换了电车加速和踩刹车适应了几天，现在换成单踏板模式，好很多了。我才开了几天的电车，就有点不想开油车了，哈哈😃（个人观点，不要喷我😭）从去年年中就开始关注，5月份果断入手，而且现在优惠力度也很大，还有补贴。就果断提车啦。,雨刮器有点神神经经的，还有是屏幕显示驻车辅助已降级，估计距离不准确，不知道什么问题。有车友分享下么,本人179。体重90KG。后排我觉得可以。前排完全没啥问题。,基本上可以指哪打哪，加速超车一气呵成。友情提示（开车还是安全第一啊）,我这几天用的舒适模式，改天可以试一试其他模式😊,高速可能用电量比较快，开了500多公里，有400这样是开高速。我觉得400多续航可能不太有，还有就是车友说的单踏板模式会省电好多，我昨天特提就设置了这个模式。看看耗电量吧,外观也好看，侧脸杀。哈哈😃家人们觉得怎么样。,好多朋友说内饰像毛呸，我个人是可以接受的，不用太多复杂的软件，够我用，太多奇奇怪怪的我也搞不来,目前没太多感觉，一直开车比较多。路段查的没怎么去过
Model Y 2024款 后轮驱动版,有心人___,油门响应速度，驾驶感受，简单干净的内饰，侧面线条,没有hud，电车续航还是短了些，没有座椅通风,我186坐进去也不紧促，挺好的。储物空间很大,加速响应挺好的，跑了800公里高速也不错，是一个让人喜欢开的车。用习惯单踏板，确实不喜欢踩刹车了,400公里左右还是少了些，节假日远途还是吃紧。希望电池技术再发展，早日突破1000公里,太阳底下很好看，侧面线条不错。不过还是model3更好看，但是对我来说太小了,挺喜欢这种简简单单的内饰的，不过没有hud和座椅通风，真的差评,整体还不错吧。现在同价位也有很多国产可以选，自己还是选了销量最高的，省心,地图不如手机好用。紧急避障救了我一次，差点追尾。前车追尾提示挺好用，希望网上那些情况不要出现在我身上
Model Y 2024款 后轮驱动版,沈阳车友7018630,这个车最满意的就是，他的操控特别精准，方向指哪打哪，加速给力，自从买了这车想去哪就去哪，再也不用操心油费了，比较按了家充，充满只需要一顿饭钱，还有就是买特斯拉价格特别透明，没有套路，这个是非常值得推荐的我,这个车最遗憾的就是没有官方给的座椅通风，一到夏天后背屁股总是湿漉漉的，也不敢去外面改装怕影响质保，还有没有焕新3的环抱是氛围灯，现在的氛围灯太单一了，也不敢去外面改装，还有头顶不安防晒是在太热了，放在外面都有60多°了，让人怀疑人生兼职。,超大的后备箱，放倒就可以露营，每到中午休息时候是我必须要在里面眯一下的，物品储存空间也是特别充足，能赶上小货车了,动能回收特别好，一开始还不是很适应，习惯了之后简直没得说，我感觉再也换不回油车了，加速给力，非常只给，非常有乐趣的驾驶感受。让人爱不释手。,在城市里续航还是满足的基本上一个礼拜也就冲个1-2次电，高速折扣略微不足有点后悔没有上长续航了，家里有个充电桩还是能满足日常需求的,溜背的造型是我特别喜欢的一点，就喜欢这种运动信息特别足的感觉，无边框的车门特别帅气，就是有点担心关门重的时候会不会影响，看到别人使劲关门，总是忍不住提醒。,特斯拉的超充都在商场我觉得很方便，上楼逛逛街下来就充满了，这个是特别方便的我，遗憾的我就是价格小贵，而且还要交两份钱，要是收个充电钱我觉得这样会很好，希望以后能调整。,内饰做工简约一些，单数没有特别味道是非常好，唯一可惜的是现在没有座椅通但是空调效果非常给力，音响是我非常喜欢的虽然不是很有名的品牌，但是调教的我真的很好，能满足我各类音乐的风格，朋友而且露营可以外放是非常方便的。,我是赶上活动分期买的，个人感觉现在分期免息优惠力度还是特别大，没有最便宜的价格只有最合适的方案，适合自己就快下手吧
Model Y 2024款 后轮驱动版,梦想家Francis,"1. 电耗控制。每次车机导航给到的预计的剩余电量百分比都是很准的，解决了一些续航里程焦虑。
2. ap开启后，在高速和快速路可以控制一些能耗，并辅助车道保持。但是注意力还是要集中。",车机导航：实时的避开堵车跟手机高德地图相比，感觉还是没那么智能。,平时一家三口使用，空间足够。虽然自己加装了中控下方储物层，类似中控扶手箱的储物空间的隔层，在某宝一搜一大堆，也确实因为原厂的空间够大，把空间分隔一下，使用了十几天还是挺好用的。,前备箱应该是这辆车最大的亮点了，尤其是停在地下车位，停车后后方是墙的情况下，前备箱用起来就太方便了,主驾位置可以设置“方便进出”功能，上下车都会自动调节座椅，这个还是很好用的。由于第二排右侧是孩子的安全座椅增高垫，所以副驾的座椅可以调的比较靠后，足够使用。,家庭出行的话两三个24-28寸的行李箱肯定可以容纳。后排座椅放倒后可以放一个专用床垫，虽然我没用过，但看车友们的分享，看起来还是很舒服的。不常用的基本都收纳到后备箱掀起后下方的储物层，这个感觉很好用。后备箱两侧还有两个很深的储物空间，可以放些平时随手能取出的零零碎碎，后备箱看起来不那么杂乱。,四个车门都有储物空间，可以放一些瓶装水或者湿巾等等一些需要随手拿取东西，这一点好评！前排分别两个储物空间，一个是中控屏下方，另一个是扶手箱。空间还是很大的，我自己加装了隔层，用起来很方便。,最多坐老婆和孩子，前排驾驶位在“方便进出”的情况下，老婆的乘坐腿部空间大概左侧腿部空间两拳多一些，头部空间也足够，右侧安全座椅增高垫，方便幼儿园接送上下车。,从燃油车换到新能源，适应了半天就OK了。用好电门踏板的动力回收，可以明显的减少踩刹车的次数，真开起来还是很舒服的。底盘感觉很整，超车、变道都很游刃有余，在这之前真没想到model Y可以做成这样，这一点体验感是非常好的。
Model Y 2024款 后轮驱动版,设计是空ES,刚提车1周，确实比油车开起来顺手，也许是我也没开过什么好车吧。特斯拉电动车的智能化确实比油车要好一些，一个手机就可以控制车，再也不用带车钥匙出门了，感觉像买了个大玩具。虽然是城市SUV，感觉操控还可以，指向精准、加速和操控还是在线的。从油车油耗的角度来说，电车每公里的电费确实很低，目前核算在1毛钱一公里，家充装好后设置23点以后充电应该会更低。空间，空间，空间，重要的事情说三遍，空间是我最满意的，ModelY只有4750长，内部空间真的比很多五米长的车还大，家用真的很不错。,"目前没有什么特别不满意的地方，只谈谈我用车的几点感受吧：
1、2024款ModelY取消了雷达，用纯视觉方案，倒车时不显示倒车距离了，希望可以OTA改进一下；
2、2024款ModelY悬架是真的硬，过减速带是真心不爽，当然硬是为了支撑性和操控，我觉得既然是定位家用，还是可以把悬架再调软一点点；
3、我本以为特斯拉的车机系统会很复杂，结果十几分钟就完全玩会了，没达到我的预期，没有想像中的那么智能和好玩，估计“遥遥领先”的应该功能多一点，人车交互和本土化肯定要做得好一点；
4、车机系统自带的导航（百度地图）是真的难用，找充电桩可以，但是导航真不行，建议大家还是用手机导航，以免被误导；
5、2024款ModelY又减配了，中控台原来的木纹饰面减配成织物状的材质了，哎...确实是以前车主口中的“毛坯房”，还需要花一笔钱“装修”；
6、特斯拉是出了名的背刺老车主，刚提回来3月1号又出了8k的保险补贴，还是应验了那句话：你永远买不到最便宜的特斯拉！“早买早享受”这句都是安慰自己的！“晚买有优惠”这句才是真理！如果不迫切换电车的车友，请相信我，再等等......
买车本就是各人下雪，各人有各人的隐晦与皎洁。每个人的需求不一样，买到自己觉得大多数方面都满意的车就可以了，车无完车！",ModelY的空间是这辆车我最满意的方面，确实很能装。中控箱、扶手箱也比一般的车辆空间大，前备箱、后背箱下面还有一个储物箱，一家人出行的行李完全不在话下。网上有很多小物件还可以开发一些小空间来储物。这个全景天窗我比较喜欢，给人一种很通透的空间体验感。ModelY全景天窗原厂镀膜颜色比较深，二排乘坐不会感觉刺眼，天窗不用去贴膜，如果夏天感觉热就买个遮阳帘吧。,ModelY第二排空间富余量还是很不错的，头部和腿部空间都很好，没有压抑的感觉。第二排座椅可以调节靠背角度，坐姿还是比较舒服的。后门的应急拉手设计的位置非常不合理，紧急情况下确实不方便开启后门。,门板储物格、扶手箱、手套箱的空间都是很不错的，特别是中控下方的储物空间是真的大，车内前排的储物空间真的是没话说！但还是需要买个手机支架。,后背箱空间太可以了，后备箱下方还有一个储物格，一家人出行的行李完全不在话下，后排放倒后可以铺个双人床垫，秒变移动大床房，喜欢露营的家庭买ModelY不会后悔的。,前备箱空间有100多升，又能多装一些行李，我个人觉得前备箱拿取小物件是比较方便的。,操控还是很可以的，指向精准，只是方向盘有点重、悬架有点硬，目前还没有在高速上使用过AP，以后再谈感受吧。驻车没有距离提示，目前还不太习惯，希望后期OTA可以升级。,目前只充过一次电，花了30来块，正在申请电表安装家充，车友们可以给我推荐一下充电桩品牌，先谢了。开了哨兵模式感觉有点耗电，续航中规中矩吧，特斯拉的三电系统技术还是挺牛的，所以60度的电池包还是很能打的。很多其他电车品牌三电系统很占空间，搞得连前备箱和手套箱都没有。
