车名,用户ID,最满意,最不满意,空间,驾驶感受,续航,外观,内饰,性价比,智能化
Model Y 2024款 长续航全轮驱动版,小尼吃不饱,"面子里子都有了。
外形好看+空间够大+电车充电便宜
这三个点我都很满意 。预算30w。真是喜欢奔驰想着努努力买个奔驰。可是一想到加油就心疼！因为我门家用车比较多满城市跑来跑去。加油一天快一百了加电才20。这性价比是真香啊👍品牌也够大面子也够了～其实，在选择特斯拉之前看了很多电车，最后对比了一些还是选择了特斯拉，特斯拉不管是电池还是提速方面个人感觉真的很碾压同级别的车！而且Y这款车，真的很适合家用，不管是出去露营还是出门带家里人带孩子出去游玩，真的是又能装又能休息！","减震太差了
别的都挺满意的。就是这个减震太不好了。沈阳的路面坑坑洼洼挺多的。还有停车场也有减速带。开过来咯噔咯噔的真的很颠啊过山车啊🎢家人们谁懂啊😵‍💫尤其是下地库，碰到大一点的全程都是咯噔咯噔咯噔的😵‍💫真的很像在越野！",我俩一个一米八一个一米七都是大体格子。当时纠结3跟y。但是我俩体格坐3有点挤。还是Y空间大坐着舒服一些。后座空间也够用回头按个儿童座椅也够用。后备箱真的很能装！过年买送礼水果一后备箱都能放下了。特斯拉秒变特能拉。哈哈而且平时可以装一些我们采购的东西，还可以放个床垫，我们出去露营的时候包括出去玩累了的时候，可以躺在后面睡觉，后面的空间足够我跟我对象两个人睡，一点不会挤！,"快提速快！
之前开油车。次次起步比别人慢。换了特斯拉，现在好了一下就窜出去了哈哈哈哈哈
方向盘可以调节轻重。这个很人性化了之前我油车比较重习惯了。
刹车需要用力踩。这点得注意一下。有时候用不上力气踩不到位。
个人喜欢舒适的模式，开起来不累而且很安全，而且车内静音很好！
运动模式的话就真的很快了，百公里四秒多，在没有人的路上真的可以感受一下，一脚油门下去直接，嗖的一下就出去了，但是用这个模式的一定要注意一些，刹车方面一定要注意，遇到情况真的要用力踩下去才会很快的停下来！","沈阳春夏秋冬。冬天掉电快。果断选择长续航版。安全感因为我们家每天用车量比较大。满沈阳飞快赶上半个滴滴司机。冬天也就能剩一半的电吧。我们基本上是一天一充电。零上电就掉的慢了充电也挺快的，
都说东北不适合开电车，我感觉特斯拉就挺好的，在冬天这么冷的情况下，家用完全是够用的，我自己家里有充电桩，回家了就冲上，第二天出门之前肯定是满电的，就算在外面冲，40分钟也是能搞定的！",颜值肯定是选车的标准之一了。我感觉这个车看着有点卡宴的感觉呢。线条很流畅喜欢💕我们买的就是最基本的黑色。黑漆很亮。但是黑色不耐脏。我们贴了车衣有贴了一层改色膜选了一个灰色！好看耐看耐脏！还带着点科技感。,我们买的黑色的车🚗内饰也选的是全黑。就是不加钱的基础班。喜欢白色内饰但是担心牛仔之类的衣服染色就还是选择了黑色，安全🔐！座椅坐着挺舒服的。建议自己买个腰枕跟头枕更舒服。座椅加热很快很热。有点烫屁股，但是大姨妈的时候烤着还挺舒服的哈哈哈,因为性价比才买的。感觉面子里子都有了。我家用车量大。买个同价位的油车加油真心心疼。之前油车我们家油车200的油也就三天吧，现在开这个一天20吧。哈哈哈，开起来一点都不心疼了！！送个朋友回家去个仓储超市去个棋盘山说走就走。性价比不用说，我对比了这么多电车，最后能选择特斯拉，性价比绝对是杠杠的！,智能化这点应该是这个车的优势吧。充电的时候可以看个电视剧玩个小游戏啥的。惬意😌哨兵模式很安心毕竟是新买的车真的很担心车子被刮。这个哨兵模式真的挺好的，因为我真的半夜被人拉过车门是我从监控看到的，而且还被人开门杀撞了们，也是我通过这个哨兵模式找到的！所以这个真的太好了实话实说，虽然现在很多机关单位不让特斯拉进，但是我个人感觉这个功能确实很有用，很不错！
Model Y 2024款 后轮驱动版,at9j5holq,最满意的就是他的空间因为我有宝宝吗所以买车的时候打开它的后备箱我直接就订了哈哈真的超级超级大，还有我喜欢颜值这车的颜值就是长在我的审美上真的太喜欢了我太爱开了：而且买特斯拉的售后服务巨好真的。,那就是地盘跟刹车片了、地盘感觉过坑有点硬、刹车的时候有刺耳的声音我也不太懂怎么回事儿,我媳妇儿是孕妇前排特别的大因为他的肚子大吗坐刷车费劲但是特斯拉跟宽敞,加速我感觉人在前面跑灵魂在后面追哈哈偶尔打开一下标准模式特别爽,我在沈阳续航表现比同级别车要完美很多因为沈阳温度也不是太低所以续航我认为完美,外观的线条我很喜欢特别是宽体的设计我简直太喜欢了,我媳妇儿就奔着内饰去的我感觉看着很高级我就不喜欢冰箱彩电大沙发,性价比超级高反正也是因为我喜欢这款车吧价位性价比太高了,语音功能特别好用一按就出来很方便我基本上都很实用
Model Y 2024款 后轮驱动版,鬼火中年的玩具车,从开了10年的手动捷达换到这个车，哪哪都觉得比之前的车好太多了😂,"最不满意的就是购车过程体验太差，其实一开始真不打算买特斯拉的，看过了很多电车，觉得现在国产电车也很不错，选择也很多，选车过程中看了零跑c11 c10，深蓝s7，汉、海豹等等，比较喜欢深蓝s7，毕竟车也不小，而且价格也比较合适，老婆看了也比较喜欢，可是老婆还是最喜欢特斯拉，一直都想要买这款，中间也讨论过，老婆也吵过，最后还是按照老婆的想法提了这款车。
下定到提车中间被套路了两次，第一次下定被成都的销售套路了，下定了23款的一辆退保车，说是优惠了但是其实优惠得很少，后来也听别人说那款车都挂了很久了也没卖出去，所以后来没有去提，但是一直协商退定金也没协商下来。
第二次是被本地销售套路的，承诺了一大堆东西和车辆优惠，结果在4.22优惠出来那天也没联系我，我看到网上有优惠后去联系，结果发现他离！职！了！也可能是他正好在特斯拉的裁员大军里。但是离职后一直没有主动联系过我告知我这件事，并且特斯拉官方也一直没有派新的销售和我对接，包括销售给我承诺的优惠政策和赠品都没有了，过后就和特斯拉开启了扯皮模式，一直投诉可是没卵用，整个过程体验很差，我是真的不想要了，想换其他品牌了，可是还是老婆想要，没办法，最后就在4.30号提车了。
真的希望好好整改一下吧。",我是从开了10年的手动捷达换过来的，鸟枪换炮，这个空间我很满意，和媳妇儿都是小个子，空间完全够用，五一出去玩在车上睡了一次，体会到了别人说的床车，真香。,"电车加速还是很给力的，从油车换到特斯拉，也没觉得有哪里不适应，虽说是suv，但是和我之前的轿车没什么区别，开车山路过弯也很稳。
朋友的特斯拉是23款的，开了我的新款，觉得大差不差，各方面感受都差不多，只是4.0取消了雷达识别，不显示距离，可能对一些新手来说感官要差一点。","续航降到30％以下就会开始心慌，提车以来充了几次电，最低一次是还剩60km去充的，跑高速的话差不多跑300km就找充电桩了，不然心里没底，可能是我刚从油车换过来，对这个续航还不适应比较心慌吧，不知道其他车主是不是会更大胆一点。还是希望特斯拉能加大电池吧，毕竟现在其他品牌的电车，入门级别配备的电池容量都比特斯拉的大😂
从油车换到电车的单踏板模式没有不适应，感觉这个能耗也比较低，其实平时我开车并不慢，高速和城市道路、国道都开了，也没出现网上那些动不动能耗在16kwh以上的现象。",外观见仁见智，每个人喜欢的和感受的不一样，对于我来说是很喜欢这款车外观的。,内饰:出了名的毛坯房，需要装饰的地方太多，但是也有人喜欢这极简风格的，对于我来说不好不坏吧，媳妇儿就按照自己的喜好布置了。,讲真的，性价比真赶不上国产车，各方面的配置等国产电车现在做得越来越好，现目前特斯拉的配置和价格是对不上的，还是希望放下自己电车老大的傲气，顺应购车人的意见改进一些。,"特斯拉的智能放在几年前就是老大，但是现在国产车越来越多，智能本土化也做得越来越好，和其他品牌的电车相比，现在还是稍显落后了。
但还是那句话，对于从10年手动老车换到这个车，还要啥自行车，比以前的车智能太多了，够用就行。"
Model Y 2024款 后轮驱动版,SoberLau,提速快，空间大，电耗低，隐形配置高，方向精准,转弯半径太小，座椅太硬放不了太低，长途驾驶会有些疲惫感,空间大到不可想象，满满一后备箱完全可以做到车内隐形，各种角落都可以成为秘密储物箱,加速有力，电门设置合理，方向盘力度适中，刹车线性。总体来说是台好车,60度的续航堪比80度，电耗控制做的特别好,经典流线型鼠标外观，再过十年也不过时，星空灰配熏黑轮辋，动感十足,内饰简洁，配置丰富，集成到屏幕科技感十足。,31的标续太高端，24.99加免息的标续太划算，一个字冲,看不到的配置特别丰富，越来越喜欢这个毛坯房了
Model Y 2023款 后轮驱动版,王阿圆,购买特斯拉modle Y大概八个月的时间，最满意的地方就是续航里程还是很精准的。而且超级充电站充电非常方便，电池预热以后的充电速度非常快，而且特斯拉自己的超级充电站没有占充电位置不充电的车主，不像第三方充电站就很麻烦，要么停着油车，要么停着新能源不充电的车，让需要充电的车主很烦恼，。还有就是价格很透明，不像传统ssss店套路超级多，这样对每个车主都一视同仁，很公平，,这个车最大的遗憾就是夏天的天窗，有点吸热，不过特斯拉的配套产品可以自己购买遮阳帘，电动的，手动的都有，花点钱都是可以解决的。还有就是希望有座椅通风功能，外面改装需要动线路，有点不放心，在网上可以买通风坐垫也是可以解决这个问题。,空间是我最满意的，后备箱，后备箱，后备箱底层还有个隐藏空间，很深，装载能力真的是特别棒，后座放平以后铺个床垫就是露营车了，出门酒店钱都省了，还有就是主驾驶扶手箱很深，储物空间真的是特别棒。,特斯拉是我目前开过新能源车型里油门响应最精准的车，因为在换车之前也试驾了其他国产品牌的车，除了配置多了一些，真的在转向精准度和油门响应程度跟特斯拉不在一个水平线上。还有就是单踏板模式用习惯的人，真的是太香了。,我的城市在东北沈阳，冬天最冷也将近零下三十度了，基本5折的续航吧，因为家里安装了充电桩，充电还是非常方便的，也没有续航的焦虑，就算出门特斯拉超级充电桩到处都是，充电速度快，没有恶意占车位的，所以还是非常方便的。,百看不厌的溜背车身流线造型，科技感十足，路上的回头率还是挺高滴。,最简单的才是最高级的，本来我也不喜欢车里有太多花里胡哨的东西。,我觉得特斯拉这款车，是老百姓花二十多万能买到最好的新能源汽车了，完善的车机系统，算力强大。很多人吐槽特斯拉的各种缺点，可是在销量上遥遥领先，销量可以说明一切问题。,ota系统的升级真的是特别棒，不论是哪年购买的特斯拉车型，在有新功能更新的时候可以全部覆盖，不需要去ssss店升级，晚上回家设置具体升级时间，就什么都不用管了，第二天就多了很多新的功能，这的很赞。
Model Y 2023款 后轮驱动版,LeeLee0404,1.最满意的就是整车的科技感，极简化的设计2.电车不用加油省钱3.开的时候很安静4.电车加速非常的快，非常刺激5.空间也比较大，后排可以放一个双人床，野外露营的时候还可以休息。,1.内饰过于极简，但这也是我喜欢的感觉，科技感未来感2.后轮驱动操控感很好随之而来的也是冬天会滑一点，如果冬天没有雪地胎，在路上不敢快开3.大天幕很好随之而来的也是会比较热,整个车非常的能装，区别于传统的油车，前面也能装很多东西，后备厢更不用提了，放倒可以放一张床，储物空间巨大，自驾，露营出去玩想放什么放什么。,加速非常的快，操纵很好，指哪打哪，油门力度刚刚好，起步也很快，跑高速开启ap简直不要太爽，非常的灵敏，动能回收系统很好用，但是单踏板我还是得习惯一段时间,春夏秋续航都可以接近1：1.2充电时间非常的迅速，正常充电桩不到一小时可以充满，但是冬天会打一些折扣续航，后悔没有买长续航，现在开电车也不用省钱想去哪就去哪，出门上个厕所都想开车,当初买的时候就是最基础的全黑外观，可以说是非常的喜欢了 黑色就是沉稳 稳重，以后改颜色也方便，车头低趴，整个线条非常的流畅。都说买了特斯拉不改色等于白买，所以以后肯定会进行改装，改色！,内饰简简单单没有过多的花哨东西比较喜欢，空调调节功能很灵敏，前后排座椅加热非常有用，可以说整个内饰都是毛坯房了但是这就是未来科技的发展所在，一切都是控制在屏幕上一切简化，自己想怎么装修就怎么装修,"当初本来想买3但是这俩当时差了不到一千就想一步到位直接买了y,后来赶上8000保险补贴，6000政府补贴总的来说还是很划算，相对比油车性价比高的出奇充满电也就30块钱能跑400km,后期也不需要保养，性价比非常高",智能化挺高的ap自动驾驶大屏也很灵敏可以跟很多软件兼容，要是能搭载CarPlay就更好了简直是无敌，大屏幕还可以当ipad玩可以在充电的时候消磨时间玩玩游戏都可以。
Model Y 2023款 后轮驱动版,WBQ0621,1:特斯拉model y的驾驶感受，让我感觉和以前传统的油车不是一个时代的产物。2:从经济方面来说也是特别的省钱。 3:空间也非常大，还有露营🏕️模式。,"1，内饰真的是毛坯房，我买完车之后自己还买了好多的配件。
2，和国产车来比，配置低了很多，而且续航里程也不多，冬天特别后悔没买长续航。
3，自动泊车和自动变道还得需要加钱买。经常感觉自己是大韭菜。",特斯拉model y的空间真的非常大，前备箱，后备箱以及后备箱下方储物格以及车座下面都能储藏很多东西，我的朋友，开着特斯拉model去全国自驾游把所有的东西都能放在车上。基本上没住过旅店,让我特别喜欢驾驶特斯拉，因为真的能做到人车合一的感觉，尤其是上手之后用的“单踏板模式” 让我基本上没踩过刹车。 脚下的电门踩多少有多少，相当于是没有延迟，我也开过朋友的其他电车，感觉肉筋筋。,"为啥续航我给的分这么低？就是因为我买的是标续，虽然说在市内通勤完全够用，但是想要出远门的话，着实有点儿不太够用 ，买特斯拉没后悔过，唯一后悔的就是没买长续航。
尤其在东北的冬天，标续续航里程也就是200公里",外观是我喜欢的样子，前脸儿。跟保时捷的感觉一样，但我不喜欢特斯拉毛豆y的后备箱那，个人感觉有点儿憨,"作为20多万的车，跟bba相比，内饰可以说啥也不是，没有豪华车的影子，还得需要自己装修，但我开了几个月的时间，发现越瞅越顺眼！就那种没有多余的东西，所有的操作基本上都集中在屏幕，反而让我更加喜欢上了这种简洁的感觉。。
差的那一颗星，就是朋友上我车，总被吐槽太简陋。","特斯拉性价比对比传统燃油车来说，性价比非常高，因为能节省不少的油费和后期保养费用。
但是对比其他国产新能源的汽车来说，性价比不是很高。因为现在国产车也太卷了，配置，价格都完全碾压特斯拉。","智能化是我喜欢电车的主要因素，其中Ap辅助驾驶可以让我很轻松的开高速。还有车机的娱乐功能，可以无线畅玩儿，不用担心没电。
如果花钱解锁：自动泊车，召唤功能，自动变道等功能，那将会更加有乐趣"
Model Y 2023款 长续航全轮驱动版,沈阳车友1824716,"智能化是我特别喜欢的，自从买了电车之后，丰富了我的业余生活，电车和以前我的油车真的是两个时代的产物。
而且从经济方面来说，还特别的省钱，我春秋的时候跑100公里也就不到10块钱，以前的油车就得将近八九十。而且还没有什么保养的项目。储存空间还非常的大，前备箱，后备箱，后备箱储物格，到处都能放东西",不满意的地方就是跟我朋友的国产车比，同等价位的国产车免费的配置，在特斯拉身上都需要花钱，而且内饰也没有豪华车的影子。,空间五颗星这台车的空间也是我特别喜欢的原因，空间真的是非常大。我经常出去露营，在车里边儿睡觉，一点儿也不影响 。可以说是一张行走的双人大床房 。前备箱，后备箱，后备箱储物格，包括座椅下面都能放下很多东西,"驾驶感受五颗星，我喜欢特斯拉的原因还是因为它的驾驶感受真的很让人上头轻车熟路之后，开启单踏板模式，会让人有一种人车合一的感觉 。
而且底盘调教的真的非常紧实。速度快也不飘","续航三颗星
续航我只能给他三颗星，因为冬天电的消耗真的很大。
如果要是城市通勤的话是完全没问题，但去年冬天我去了一趟长春，中间就得需要补电，要不然的话怕到不了 。回农村的话，我也得准备一个随车充，要不然怕没有电了很麻烦。真的有里程焦虑",外观五颗星，外观是我特别喜欢的样子，因为以前我就特别喜欢保时捷，感觉和保时捷一样 。外面看着一点也不臃肿，里边儿的空间还很大,"内饰我给他三颗星
作为全下来将近30万的车，跟传统的豪华车比。内饰很简洁。价格是豪华车的价，内饰却完全没有豪华车的影子
不过用料，瞅着还是挺扎实的","性价比五颗星
特斯拉和以前我的燃油车比性价比真的非常高，节省出来的不光油费，还有后期保养的费用。
用车成本可以说是非常的低。
有了这台车之后，我想去哪儿都不是问题，说走就走。","智能化五颗星
智能化是我选择电车的主要原因，平时我要是上高速的话就开启ap辅助驾驶。非常的方便。比我自己开都稳 。而且特斯拉还非常的良心，9块9就可以无限的用车机流量。看抖音刷快手 甚至是唱歌和玩游戏都没问题"
