车名,用户ID,最满意,最不满意,空间,驾驶感受,续航,外观,内饰,性价比,智能化
Model Y 2024款 长续航全轮驱动版,重庆车友7626263,"总的来说，我对特斯拉model Y这款新能源汽车的加速感受非常满意。不管是外观设计、内饰质感、驾驶性能再到续航里程，这款车都展现出了非常高的品质。作为一款电动汽车，特斯拉无疑为我们提供了一种全新的出行选择,最满意的地方：用车成本很低！一是维护成本低，不需要像以前的油车一样更换机油、滤芯、火花塞等零件，使用成本几乎为0。二是电的费用低，现在夏天短途自驾游或者露营时放心大胆的开空调，坐在车里看风景。我在家里的装了充电桩随用随充，非常的便捷，而且快充只要1小时即可，等于我吃个晚饭的时间又是满血复活，我基本一个星期充电一次就能满足日常用车需求，根本就没有所谓的续航里程焦虑，在我这里是不存在的。其次就是车内空间极大，内部空间非常宽敞前排座椅非常舒适，座椅的填充物很足包裹性很好，能够提供很好的支撑和舒适度。此外，前排座椅还具有多项调节功能，可以根据不同乘坐人员的身高和驾驶习惯进行调整。就算长时间行驶也不会感觉腰酸背痛，中间扶手的设计也非常实用，可以放置很多小物品比如充电宝，证件，手包等等都可以归置好。后排在满座的情况下没有拥挤感，腿部空间也比较充裕。 后备箱容量非常大，可以容纳多个行李箱和其他物品。后备箱的开口也非常大，方便装卸物品，非常实用和方便。",最不满意的就是提车时间比较久，我从下订单到提车等了好几个星期，期间是蛮煎熬的。,我身高184厘米体重178斤体格很大，在驾驶位头部离车顶还有一拳距离，座椅坐姿很高驾驶视野开阔没有盲区。,起步/加速动力很给力，一脚油门下去，立马能感受推背感的刺激。方向盘轻重适中，指向精准没有虚位，打起来手感不错。轮胎抓地力极强刹车灵敏性也值得称赞，让人心里踏实。高速行驶中开空调或满载加速时，动力输出依然稳定没有疲软感。弯路/并线车身随车性优异很稳健让我印象深刻，侧倾控制得很好。底盘用料扎实车辆在行驶过程中很稳定。前后独立悬架减震过滤性很好，悬挂系统可以有效吸收路面的颠簸，保证行驶的舒适性。在实际驾驶过程中，我可以轻松地应对各种复杂的路况，非常自信。就算在市区拥挤道路行驶时，它的动力表现非常出色，能够轻松应对交通拥堵和车辆加塞等情况。当我需要超车或者急加速时，深踩油门后车辆会迅速响应，电门反应很线性没有延迟感。,续航方面绝对满意，现在夏天我全程开空调行驶续航能达到550公里，而且表显准确没有虚标。,它采用了封闭式的前格栅设计，让人一眼就能感受到它的独特气质。大灯的造型犀利极具压迫感，犹如猎豹的双眼，为车头增添一抹凶悍的气息。引擎盖上的线条流畅而富有层次感，车身腰线流畅运动气息浓厚，从车头一直延伸到车尾，将整个车身勾勒得更加动感且协调。前后轮胎的位置恰到好处，不仅增强了车辆的稳定性，也使得整个车身看起来更加美观。,内饰用料考究材料质感细腻柔和，15英寸大中控屏触感流畅，多功能真皮方向盘手感丰富。,它有着极高的颜值，极低的用车成本，强劲的动力输出，我觉得性价比还是非常高的。,配置有手机APP远程功能，语音识别控制系统，车载空气净化器，车内PM2.5过滤装置。
Model Y 2024款 后轮驱动版,文山小阿壮,这个是我的首辆车，还是因为在做民宿，有时候会需要接客人或者外出买买东西才买的，一开始没有想买新能源，后面听我朋友说了如何如何的省钱，才去看了特斯拉。虽然特斯拉的内饰有点毛坯房的味道，但是不得不说，在驾驶感受，还有外观上面确实是先人一步的。就拿这个外观来说，可以说是机具跑车的设计了。还有比较长的续航，现在到处也都是充电桩，家里再安排一个家充，续航焦虑基本没有。哪怕出远门也不会太过于担心。,内饰确实是比较捡漏，当然了，这个是见仁见智的，人有的就喜欢这种风格。我是不太在意这方面的人，但是也觉得有点过于简洁风了。刚买回来的时候踩刹车会有异响，不知道是不是新车刹车比较紧的原因，到现在一个多月，偶尔也会有声音，只是出现的频率没有最初那么高了。,这个车的高度虽然只有一米六几，相对比很多中型SUV定位的车型来说是不够的，但是好在是全景的天幕，人坐在车里的观感还是比较舒适的，不会觉得压抑。如图，副驾驶全车最宽敞也最佳乘坐感受，我175cm身高，腿基本可以打直。后排座三人坐还是不挤的，地台也是平的，放脚的舒适性比较高。接近两米九的轴距还是不错的，我坐后排还是有两拳空间。后备箱家用级别，足够。,首先方向盘的握持感不错，我是汗手，开这个车都不容易打滑过。车子的辅助驾驶很不错，智能的驾驶功能可以说是做到了挺高级别的。动力极好，踏板轻轻一踩，动力即刻响应。超车和高速路跑很有点推背感的。,续航正常跑个四百多公里算是不错的，这个是说的实际续航，和官方的数据还是有一定打折的。但是实际还是没有什么续航焦虑。,这个车的外观是真正的做到独树一帜的风格的，以至于我看现在很多新能源车的车头都在往这个方向设计。及其像跑车，车头自然线条收紧的设计，真的是有够帅气的。侧边看车顶线条，车门腰线，黑色轮毂，那都是长在了我的审美观上面的。车尾微微翘起的尾巴也比较独特。,内饰就真的如果很在意豪华性的人的话，就不是很推荐哈，可以看看我们现在很多国产新能源就在内饰做得很不错。特斯拉这个有点过于的简单了。就一个屏幕，啥也没有了。,我一直以为model y要三十个w，结果现在这款才24.99w，价格还是挺合适的。性价比不错。,基本上都是靠语音操作，而且语音系统，车技交互什么的都很智能化。
Model Y 2024款 后轮驱动版,shinebamboo,"最满意的是高科技的一些配置。特斯拉的中控大屏上对周边行人、非机动车、机动车基本上都能准确感应，机动车还能划分卡车，面包车，小汽车；周边障碍物，划线车位都能显示清清楚楚；车外摄像头，在倒车，尤其左右转弯时，周边的行人和车辆都能看到。这些都大大提高了行车安全性，不仅仅能看清楚，它对于距离判断也是相当精确，特别是环状图形的显示让倒车、会车都变得异常简单。
另外我也比较喜欢它极简化的车身造型和设计风格，简单干净，没有过多复杂的线条。
同时它的操控也会让很多老司机爱不释手，当然Y灵活多变的车内空间才是我最最最满意的地方。","最不满意的地方分为硬件设计和一些系统BUG，另外就是导航！
硬件方面：车轱辘突出，如果马路牙子高，你想停的贴边，那么很容易刮擦，几乎每个车友都有这个困扰，那肯定就是硬件设计问题了！
BUG方面就是雨刮器自动模式真的非常神经，小雨它就是不刮的，还得手动切换。但是大晴天的，它时不时的碍眼地来刮几下。
以上都不算什么，个人觉得特斯拉全系列的导航问题才真是让人头大，导航系统自动自带就是百度，反正没高德好用而且很多位置还没有，输入一个位置后，还不显示具体什么路几号，难怪很多特斯拉车主都要装一个手机支架，想来还有些讽刺。","买这个车就是因为它的空间，很多做过车的人，都说这个车里面坐的空间大。
这台车空间的优点我觉得可以分为几个方面来单独夸赞下。
首先Model Y 不论是前挡玻璃还是四个车门和车顶的天幕，面积都特别大使得它有很好的透光效果，让坐进去的人都感觉视觉非常通透和开阔。
第二点它内部的空间确实很大，就算满座5人也完全不拥挤，并且车身内部的高度控制的还挺不错的，不像有些品牌的车人就像是坐轿子一样被顶起来的。
最后就是后排空间的可玩性很高，我们家人最满意的是后排空间可以放下直接变床，打开露营模式后再铺一个垫子就秒变午休和露营空间","Model Y这台车会让你爱上驾驶，虽然它比Model 3要高大不少，但特斯拉的驾驶基因也在它身上传承了下来。
高速上提速快坐着稳，我的后轮驱动版0-100公里的加速只需要5.9秒就可以完成，在转弯时也能有很好的支撑性。
同时它精准的雷达和各种摄像头识别在停车时，因为有周边人、车、障碍物感应，真的很方便。安全性大大提高。
另外还有一点就是特斯拉的辅助驾驶系统，在高速巡航，开车走神时都能给到我很安全的帮助。","原来以为特斯拉跟其他国内新能源比较续航会好一些。
但是实际用下来，续航让人着急，特别是高速上开空调，遇到堵车，真的至少要比预计多预留100公里以上，看来电车的整体续航大家都差不多，如果经常跑高速特别是在冬季用车比较频繁的朋友要考虑清楚了。","特斯拉走的是极简设计风格，Model Y 的外形整体是非常流畅而且非常简洁大气的，我特别喜欢它正面和侧面的造型，非常科幻有很强辨识度和未来感和市面上的一众车型比起来非常的与众不同，有自己的设计风格，侧面的车身线条也比较优雅，看着不油腻，并且这个轮毂造型确实很科幻很有穿越感。
整台车除了后备箱像个拱桥一样隆起看上去比较笨重，还是非常的协调。","特斯拉车内设计就是简洁大气，用过后你就会爱上那种简简单单的感觉，有些北欧极简风和断舍离的感觉。
我特别喜欢中控台的设计感觉，简洁干净的中控台黑色主调外加银色贯穿式装饰板做搭配，只保留了一个超大的中控屏幕，看着非常干净舒适，全车风格都这个调性非常的特别有个性。不过有些东西就需要自己添置一下了。
超大玻璃天幕让人又爱又恨，买车的时候销售说可以防各种的紫外线、太阳、啪啦啪啦的一大堆，但是实际使用中夏天真的是头顶桑拿，必须要自己加一个防晒装备。",买这个车还是挺满意的，最大的感受就是让你会爱上开车，各种人性化操作，行车安全性高 ，操控性好。扣一分的原因是我26.39万买的，当时没有优惠，买完一个月就跌了 心塞！,"基本配置都有，但是不会多配置一点，有点网上朋友说的毛坯房意思
座椅可以调节拱背这个不错而且自动匹配驾驶员习惯，这个太方便。后排座椅可放下秒变床，这个太舒服了。
希望能把导航这个功能做好，不想用百度，能不能让用户自己在高德和百度之间做选择！"
Model Y 2024款 后轮驱动版,成都醉梦人,人生第一辆车，必须从电车开始，很早之前就打算买车了，当时还打算买油车的，但是座位年轻人嘛，必须跟上时代的步伐，现在的新能源汽车是越来越智能了，也非常符合当下年轻人的喜好，所以果断地放弃了油车，要说为什么选择特斯拉，那肯定是外观和智能啊，外观不用说大家都知道，非常的独特，我是觉得它的造型很科幻，像概念车一样，科技感特别的强。智能化也非常高，特别是智能驾驶，语音交互啥的，直接甩油车几条街。,后悔没有直接上长续航版的车，现在每次回老家就显得有点尴尬，跑高速掉电更快，必须在中途要充一次电才能跑完，其实也就差那么几十公里的距离，如果是长续航版本就完全没问题了。,空间也够大，虽然是紧凑型的SUV，但是平时基本上都是我一个人开，完全没有感觉到空间的局促，反而每次坐在里面会觉得很大，很空旷。我喜欢经常邀约几个好友出门耍，带点烧烤火锅帐篷啥的出去野游，每次后备箱就派上大用场了，看着不大，实际上却很大，很能装的。,虽然我很少开油车，但是自从开了电车后，我就发现他们完全不是一个级别的东西，电车的舒适性太高了，电门的灵敏性更高，起步提速都非常快，方向也很灵敏，指向完全没有偏差，我的驾驶习惯比较偏激烈，我喜欢它给到的那种人车合一的感觉，特别棒，身体的各种操控动作它都能够第一时间响应，跟我的思维是完全契合的。,现在夏天电耗大概是14左右，市区开这段时间不热，开窗不用开空调，满电续航430KM左右。市区开完全够用了。,外观很科幻很拉风，每次在街上看到特斯拉的车都会多看几眼，所以下定决心买车的时候首先就去看了特斯拉，越看越好看，都没来得及对比其他车型就果断下定了。其实我也说不清楚它到底那些地方做得好，主要就是整体给我的感觉特别有高级感，有非常浓厚的科技范，而且车身的线条也是简单明了，没有太多花里胡哨的设计。这点可能是我很在意的地方了。,内饰属于极简风格，一个物理按键都没有，全靠中控屏幕操控，既简单，又实用，整个前排看起来就特别的干净整洁。超大的中控屏布局合理，操作方便，能够快速的找到你需要的功能，特别人性化，座椅的舒适性也挺不错的。,我买车时没考虑太多的东西，只要自己喜欢，在自己的预算范围内就行了，特斯拉刚好都满足我的需求，所有就果断下手了。我觉得有性价比就行。,配置了两颗HW4.0的芯片，辅助驾驶功能特别好用，跑高速我经常用到。太爽了。
